{
	"$schema": "https://emdashcms.com/seed.schema.json",
	"version": "1",
	"meta": {
		"name": "EmDash CMS Site",
		"description": "Landing page and release blog for EmDash CMS",
		"author": "EmDash"
	},

	"settings": {
		"title": "EmDash CMS",
		"tagline": "An open source Astro CMS built for humans and agents."
	},

	"collections": [
		{
			"slug": "pages",
			"label": "Pages",
			"labelSingular": "Page",
			"supports": ["drafts", "revisions", "seo"],
			"fields": [
				{
					"slug": "title",
					"label": "Title",
					"type": "string",
					"required": true
				},
				{
					"slug": "content",
					"label": "Content",
					"type": "portableText"
				}
			]
		},
		{
			"slug": "posts",
			"label": "Posts",
			"labelSingular": "Post",
			"supports": ["drafts", "revisions", "search", "seo"],
			"fields": [
				{
					"slug": "title",
					"label": "Title",
					"type": "string",
					"required": true,
					"searchable": true
				},
				{
					"slug": "excerpt",
					"label": "Excerpt",
					"type": "text"
				},
				{
					"slug": "content",
					"label": "Content",
					"type": "portableText",
					"searchable": true
				}
			]
		}
	],

	"menus": [
		{
			"name": "primary",
			"label": "Primary Navigation",
			"items": [
				{ "type": "custom", "label": "Docs", "url": "https://docs.emdashcms.com", "target": "_blank" },
				{ "type": "custom", "label": "Blog", "url": "/blog" },
				{ "type": "custom", "label": "Discord", "url": "https://discord.gg/YY9vBaQRYt", "target": "_blank" },
				{ "type": "custom", "label": "GitHub", "url": "https://github.com/emdash-cms/emdash", "target": "_blank" }
			]
		},
		{
			"name": "footer_product",
			"label": "Footer: Product",
			"items": [
				{ "type": "custom", "label": "Try it", "url": "https://try.emdashcms.com", "target": "_blank" },
				{ "type": "custom", "label": "Docs", "url": "https://docs.emdashcms.com", "target": "_blank" },
				{ "type": "custom", "label": "Blog", "url": "/blog" }
			]
		},
		{
			"name": "footer_community",
			"label": "Footer: Community",
			"items": [
				{ "type": "custom", "label": "Discord", "url": "https://discord.gg/YY9vBaQRYt", "target": "_blank" },
				{ "type": "custom", "label": "GitHub", "url": "https://github.com/emdash-cms/emdash", "target": "_blank" }
			]
		},
		{
			"name": "footer_resources",
			"label": "Footer: Resources",
			"items": [
				{ "type": "custom", "label": "Release notes", "url": "/blog" },
				{ "type": "custom", "label": "Documentation", "url": "https://docs.emdashcms.com", "target": "_blank" },
				{ "type": "custom", "label": "Playground", "url": "https://try.emdashcms.com", "target": "_blank" }
			]
		},
		{
			"name": "footer_social",
			"label": "Footer: Social Links",
			"items": [
				{ "type": "custom", "label": "Discord", "url": "https://discord.gg/YY9vBaQRYt", "target": "_blank" },
				{ "type": "custom", "label": "GitHub", "url": "https://github.com/emdash-cms/emdash", "target": "_blank" }
			]
		}
	],

	"content": {
		"pages": [
			{
				"id": "home",
				"slug": "home",
				"status": "published",
				"data": {
					"title": "Home",
					"content": [
						{
							"_type": "marketing.hero",
							"_key": "hero",
							"headline": "The CMS for you and your agent",
							"subheadline": "EmDash is the spiritual successor to WordPress: an open source, agent-ready, full-stack CMS for Astro",
							"primaryCtaLabel": "Try it out in our playground",
							"primaryCtaUrl": "https://try.emdashcms.com",
							"showAgentActions": true
						},
						{
							"_type": "marketing.features",
							"_key": "features",
							"headline": "Built for the way you actually ship",
							"subheadline": "Type-safe content, server-rendered Astro pages, and a single binary deploy on Cloudflare. No SaaS dashboard between you and your data.",
							"features": [
								{
									"icon": "code",
									"title": "Schema as code",
									"description": "Define collections, fields, and relationships in a seed file. Get generated TypeScript types and a fully migrated database every time you run dev."
								},
								{
									"icon": "zap",
									"title": "Astro-native",
									"description": "First-class Astro integration. Server-rendered pages, content loaders, image components, and Portable Text rendering with no glue code."
								},
								{
									"icon": "cloud",
									"title": "Runs on Cloudflare",
									"description": "D1 for content, R2 for media, Workers for serving. One stack, global by default, deployed from a single command."
								},
								{
									"icon": "users",
									"title": "Admin humans love",
									"description": "Drafts, revisions, scheduling, full-text search, taxonomies, menus, and live preview, all in a fast modern editor."
								},
								{
									"icon": "shield",
									"title": "Built for agents",
									"description": "Every CMS operation is exposed over MCP. Agents read schema, edit content, and publish through the same typed APIs the admin uses."
								},
								{
									"icon": "globe",
									"title": "Extensible by design",
									"description": "Plugins add custom block types, admin pages, hooks, and storage. Bring your own auth, payments, comments, or analytics."
								}
							]
						},
						{
							"_type": "marketing.testimonials",
							"_key": "testimonials",
							"testimonials": [
								{
									"quote": "The entire functionality of WordPress, and then some.",
									"author": "Matt Mullenweg",
									"role": "Co-founder",
									"company": "WordPress"
								},
								{
									"quote": "The most interesting thing to happen to content management in years.",
									"author": "Joost de Valk",
									"role": "Founder",
									"company": "Yoast"
								},
								{
									"quote": "Getting from zero to a basic design is fast. I mean, really fast.",
									"author": "Brian Coords",
									"role": "Developer Advocate",
									"company": "Automattic"
								}
							]
						},
						{
							"_type": "marketing.faq",
							"_key": "faq",
							"headline": "Frequently asked questions",
							"items": [
								{
									"question": "What is EmDash?",
									"answer": "EmDash is an open source CMS built on Astro and Cloudflare. It gives you a typed schema, a polished admin, and an MCP server so both humans and AI agents can manage your content."
								},
								{
									"question": "How is it different from other CMSes?",
									"answer": "EmDash is Astro-native and self-hosted on your own Cloudflare account. Your schema lives in code, your data lives in D1 and R2, and there is no SaaS backend between you and your content."
								},
								{
									"question": "Can AI agents really edit content?",
									"answer": "Yes. EmDash ships a Model Context Protocol server that exposes content, schema, media, taxonomies, menus, and revisions. Drop it into Claude, OpenCode, or any MCP-aware tool and it just works."
								},
								{
									"question": "How do I get started?",
									"answer": "Open the playground for an instant sandbox, or run npx emdash dev in a fresh Astro project to spin up a local instance with the admin at /_emdash/admin."
								},
								{
									"question": "Where can I ask questions?",
									"answer": "Join the Discord to chat with the team and community, or open an issue on GitHub. The docs cover setup, architecture, and the full API reference."
								}
							]
						}
					]
				}
			}
		],
		"posts": [
			{
				"id": "emdash-is-live",
				"slug": "emdash-is-live",
				"status": "published",
				"data": {
					"title": "EmDash is live",
					"excerpt": "A quick look at what EmDash is, what shipped in the first public release, and where to go next.",
					"content": [
						{
							"_type": "block",
							"style": "normal",
							"children": [
								{
									"_type": "span",
									"text": "EmDash is an open source CMS built on Astro. It combines a full admin UI, structured content, and a real site codebase without splitting editing and development into separate systems."
								}
							]
						},
						{
							"_type": "block",
							"style": "normal",
							"children": [
								{
									"_type": "span",
									"text": "This site will be used for release announcements, product updates, and major changes to the project. If you want to explore EmDash right now, head to the playground or read through the docs."
								}
							]
						}
					]
				}
			}
		]
	}
}
